fileName,RevisionId,Date,Author,Comment
"./src/test/java/org/junit/tests/experimental/theories/extendingwithstubs/ReguessableValue.java","d61e2885bfae9add429f42d9ce0d9bc8c3ef72b0","Tue, 6 May 2008 16:42:11 +0000","kbeck","Adding javadoc and tweaking visibility."
"./src/test/java/org/junit/tests/experimental/theories/extendingwithstubs/ReguessableValue.java","8226e3e64a7d4ace29eb08ab6c9fc9d4055f20c9","Fri, 7 Dec 2007 15:43:03 +0000","dsaff","- Moved src directory into two directories, similar to a maven layout, to simplify build, and make it easier for maven-familiar developers to find the tests."
"./src/test/java/org/junit/tests/experimental/theories/extendingwithstubs/StubbedTheoriesTest.java","30f2b16525dabb477373be9ed3e76bb98b200806","Thu, 4 Oct 2012 22:16:45 +0200","Arjan Wulder","Issue #426 Applied new coding style"
"./src/test/java/org/junit/tests/experimental/theories/extendingwithstubs/StubbedTheoriesTest.java","8226e3e64a7d4ace29eb08ab6c9fc9d4055f20c9","Fri, 7 Dec 2007 15:43:03 +0000","dsaff","- Moved src directory into two directories, similar to a maven layout, to simplify build, and make it easier for maven-familiar developers to find the tests."
"./src/test/java/org/junit/tests/experimental/theories/internal/AllMembersSupplierTest.java","b421d0ebd66701187c10c2b0c7f519dc435531ae","Sun, 31 Mar 2013 23:52:41 +0100","Tim Perry","Added support for iterable datapoints"
"./src/test/java/org/junit/tests/experimental/theories/internal/AllMembersSupplierTest.java","93d773835c0c6f70bc89bbf5e4d273c289423a64","Thu, 21 Mar 2013 22:55:04 +0000","pimterry","Merge branch 'master' into datapoints-exceptions-#449"
"./src/test/java/org/junit/tests/experimental/theories/internal/AllMembersSupplierTest.java","5c2070d7cf981e2e103aef6fd0ef64c473331325","Sun, 17 Feb 2013 14:23:26 +0000","pimterry","Fixes #449, stopping AllMembersSupplier hiding DataPoint method exceptions"
"./src/test/java/org/junit/tests/experimental/theories/internal/AllMembersSupplierTest.java","ccf0c0af551df541e40edb07d19a57072a8b14b1","Sat, 16 Mar 2013 22:35:49 +0000","pimterry","Changed single-valued datapoints back to deferred execution"
"./src/test/java/org/junit/tests/experimental/theories/internal/AllMembersSupplierTest.java","e9d4de8e15255b03b60e935390e517d4de90a73b","Wed, 13 Mar 2013 23:13:10 +0000","pimterry","Single-datapoint methods are now only called if the return types could be relevant, and theory parameter signatures are compared with types via a prebuilt map rather than reflection."
"./src/test/java/org/junit/tests/experimental/theories/internal/AllMembersSupplierTest.java","cc8497f28e1d5a46d7940a0b36556154c83d6f7a","Mon, 11 Mar 2013 01:17:00 +0000","pimterry","Parameters are now matched on value, not defined type, for array and single-valued methods and fields."
"./src/test/java/org/junit/tests/experimental/theories/internal/AllMembersSupplierTest.java","043e82844ef2c3c0961d98a34771c84f7a950d1a","Sun, 27 Jan 2013 18:42:21 +0000","pimterry","Added named datapoint(s) support to theories, for #65."
"./src/test/java/org/junit/tests/experimental/theories/internal/SpecificDataPointsSupplierTest.java","5c2070d7cf981e2e103aef6fd0ef64c473331325","Sun, 17 Feb 2013 14:23:26 +0000","pimterry","Fixes #449, stopping AllMembersSupplier hiding DataPoint method exceptions"
"./src/test/java/org/junit/tests/experimental/theories/internal/SpecificDataPointsSupplierTest.java","043e82844ef2c3c0961d98a34771c84f7a950d1a","Sun, 27 Jan 2013 18:42:21 +0000","pimterry","Added named datapoint(s) support to theories, for #65."
"./src/test/java/org/junit/tests/experimental/theories/internal/ParameterizedAssertionErrorTest.java","74fa3d0957e59a3f1122ed8eb69b9e65ef924252","Thu, 20 Feb 2014 18:59:02 +0700","Vladislav Bauer","Fix possible NPE in method equals (ParameterizedAssertionError)"
"./src/test/java/org/junit/tests/experimental/theories/internal/ParameterizedAssertionErrorTest.java","043e82844ef2c3c0961d98a34771c84f7a950d1a","Sun, 27 Jan 2013 18:42:21 +0000","pimterry","Added named datapoint(s) support to theories, for #65."
"./src/test/java/org/junit/tests/experimental/ExperimentalTests.java","af692868db814126bbac29a1f28f5adf30c6ce1c","Sun, 17 Mar 2013 01:14:17 +0000","pimterry","DataPoints are now autogenerated for boolean and enum parameters, if no sources are otherwise specified"
"./src/test/java/org/junit/tests/experimental/ExperimentalTests.java","3375d1c3f489fc5d2b5c6629c55867bbfe2a033f","Fri, 1 Feb 2013 01:32:42 +0000","pimterry","Various improvements to named datapoint support after review."
"./src/test/java/org/junit/tests/experimental/ExperimentalTests.java","043e82844ef2c3c0961d98a34771c84f7a950d1a","Sun, 27 Jan 2013 18:42:21 +0000","pimterry","Added named datapoint(s) support to theories, for #65."
"./src/test/java/org/junit/tests/experimental/ExperimentalTests.java","80b7fbad6e37f2b229a919f595a5263dd21da8fb","Wed, 12 Dec 2012 14:09:35 -0600","Paul Holser","Ensure no-generic-type-parms validator gets executed/tested."
"./src/test/java/org/junit/tests/experimental/ExperimentalTests.java","30f2b16525dabb477373be9ed3e76bb98b200806","Thu, 4 Oct 2012 22:16:45 +0200","Arjan Wulder","Issue #426 Applied new coding style"
"./src/test/java/org/junit/tests/experimental/ExperimentalTests.java","85578d48f6459a05665329faa9b52a861e9142cb","Thu, 6 Nov 2008 20:15:27 +0000","kbeck","Now sorting tests globally"
"./src/test/java/org/junit/tests/experimental/ExperimentalTests.java","8226e3e64a7d4ace29eb08ab6c9fc9d4055f20c9","Fri, 7 Dec 2007 15:43:03 +0000","dsaff","- Moved src directory into two directories, similar to a maven layout, to simplify build, and make it easier for maven-familiar developers to find the tests."
"./src/test/java/org/junit/tests/experimental/parallel/ParallelMethodTest.java","30f2b16525dabb477373be9ed3e76bb98b200806","Thu, 4 Oct 2012 22:16:45 +0200","Arjan Wulder","Issue #426 Applied new coding style"
"./src/test/java/org/junit/tests/experimental/parallel/ParallelMethodTest.java","f71a2d4c61beedd2bc027d525c633dd9f4413ba2","Sun, 23 Sep 2012 11:57:24 +0200","Tibor Digana","synchronizer attempts to trigger different threads within timeout"
"./src/test/java/org/junit/tests/experimental/parallel/ParallelMethodTest.java","7602636601a8e024f27157cdbabee6de7e269d80","Fri, 21 Sep 2012 18:38:22 +0200","Tibor Digana","avoids reusing Executor's Thread instances"
"./src/test/java/org/junit/tests/experimental/parallel/ParallelMethodTest.java","24cbcbc12fdd2afb7d52ff354e08213db8a62edd","Fri, 21 Sep 2012 13:18:58 +0200","Tibor Digana","cleanup thread references"
"./src/test/java/org/junit/tests/experimental/parallel/ParallelMethodTest.java","c236a9e019a814b3542dcfe3a3a61b036c14d252","Thu, 20 Sep 2012 02:40:46 +0200","Tibor Digana","Improved Test: ParallelMethodTest fails few times"
"./src/test/java/org/junit/tests/experimental/parallel/ParallelMethodTest.java","8b9dfefada78a74b6b1fa34ff0bab298267f8210","Tue, 3 Apr 2012 21:24:58 +0200","Marc Philipp","Deprecate TypeSafeMatcher which is now provided by Hamcrest"
"./src/test/java/org/junit/tests/experimental/parallel/ParallelMethodTest.java","4e2455b1f142bdf8f07383082638718695e51224","Mon, 20 Jul 2009 10:35:10 -0400","David Saff","Rollback to hamcrest 1.1"
"./src/test/java/org/junit/tests/experimental/parallel/ParallelMethodTest.java","e35fb32e07a4cfe69dd86024a79d9cb3b9132e55","Wed, 27 May 2009 13:57:07 -0400","David Saff","Upgraded to Hamcrest 1.2"
"./src/test/java/org/junit/tests/experimental/parallel/ParallelMethodTest.java","bbcb8f416628bc168a2ed8353a30b4e9647abf6f","Mon, 25 May 2009 21:51:47 -0400","David Saff","Getting there with FrameworkField, but checking in before everything works, to demo squeezing"
"./src/test/java/org/junit/tests/experimental/parallel/ParallelMethodTest.java","474df716f498aa2695c422cceb3e46cad999e972","Mon, 2 Mar 2009 23:49:40 -0500","David Saff","Some test edits for release notes, but especially experimenting with MaxComputerTest: can MaxCore be written in terms of the Computer abstraction?"
"./src/test/java/org/junit/tests/experimental/parallel/ParallelMethodTest.java","34dd9f4e2bebbcf694dcb855a29edff9243a10d3","Tue, 6 Jan 2009 04:02:00 +0000","kbeck","Fixed 2191102 and 2196462."
"./src/test/java/org/junit/tests/experimental/parallel/ParallelMethodTest.java","a72b0dbef4b01e8ad0b832d9a579dd7fabd5a071","Fri, 17 Oct 2008 22:35:23 +0000","kbeck","Clean up parallel execution naming."
"./src/test/java/org/junit/tests/experimental/parallel/ParallelMethodTest.java","432e3e27df0b072f3bab066cd33214913f4c7f32","Tue, 9 Sep 2008 20:46:02 +0000","kbeck","Run methods and classes in parallel"
"./src/test/java/org/junit/tests/experimental/parallel/ParallelClassTest.java","30f2b16525dabb477373be9ed3e76bb98b200806","Thu, 4 Oct 2012 22:16:45 +0200","Arjan Wulder","Issue #426 Applied new coding style"
"./src/test/java/org/junit/tests/experimental/parallel/ParallelClassTest.java","44b426792863f5fdc8cbedfc201a0a8ba0fe83dd","Sun, 23 Sep 2012 11:49:36 +0200","Tibor Digana","synchronizer attempts to trigger different threads within timeout"
"./src/test/java/org/junit/tests/experimental/parallel/ParallelClassTest.java","623bd92d37786cdc869b219569740f96869f5b9d","Fri, 21 Sep 2012 18:36:41 +0200","Tibor Digana","avoids reusing Executor's Thread instances"
"./src/test/java/org/junit/tests/experimental/parallel/ParallelClassTest.java","e48f6d40bf755dba2da4c29a4b7e763637b61738","Fri, 21 Sep 2012 13:11:03 +0200","Tibor Digana","cleanup thread references"
"./src/test/java/org/junit/tests/experimental/parallel/ParallelClassTest.java","865e00b45a166466b614a1dbcb8440e19453c58e","Thu, 20 Sep 2012 03:44:50 +0200","Tibor Digana","Improved Test: ParallelClassTest"
"./src/test/java/org/junit/tests/experimental/parallel/ParallelClassTest.java","8b9dfefada78a74b6b1fa34ff0bab298267f8210","Tue, 3 Apr 2012 21:24:58 +0200","Marc Philipp","Deprecate TypeSafeMatcher which is now provided by Hamcrest"
"./src/test/java/org/junit/tests/experimental/parallel/ParallelClassTest.java","4e2455b1f142bdf8f07383082638718695e51224","Mon, 20 Jul 2009 10:35:10 -0400","David Saff","Rollback to hamcrest 1.1"
"./src/test/java/org/junit/tests/experimental/parallel/ParallelClassTest.java","223b34b516467bcd9cb7ebc7f49549f2e7362dca","Wed, 1 Jul 2009 13:43:53 -0400","David Saff","Getting started on Interceptors javadoc"
"./src/test/java/org/junit/tests/experimental/parallel/ParallelClassTest.java","e35fb32e07a4cfe69dd86024a79d9cb3b9132e55","Wed, 27 May 2009 13:57:07 -0400","David Saff","Upgraded to Hamcrest 1.2"
"./src/test/java/org/junit/tests/experimental/parallel/ParallelClassTest.java","474df716f498aa2695c422cceb3e46cad999e972","Mon, 2 Mar 2009 23:49:40 -0500","David Saff","Some test edits for release notes, but especially experimenting with MaxComputerTest: can MaxCore be written in terms of the Computer abstraction?"
"./src/test/java/org/junit/tests/experimental/parallel/ParallelClassTest.java","421ab330509a53302f56b209595f55b23bfdfc0e","Tue, 18 Nov 2008 22:52:31 +0000","dsaff","Max now runs the right number of tests"
"./src/test/java/org/junit/tests/experimental/parallel/ParallelClassTest.java","a72b0dbef4b01e8ad0b832d9a579dd7fabd5a071","Fri, 17 Oct 2008 22:35:23 +0000","kbeck","Clean up parallel execution naming."
"./src/test/java/org/junit/tests/experimental/parallel/ParallelClassTest.java","432e3e27df0b072f3bab066cd33214913f4c7f32","Tue, 9 Sep 2008 20:46:02 +0000","kbeck","Run methods and classes in parallel"
"./src/test/java/org/junit/tests/experimental/max/DescriptionTest.java","30f2b16525dabb477373be9ed3e76bb98b200806","Thu, 4 Oct 2012 22:16:45 +0200","Arjan Wulder","Issue #426 Applied new coding style"
"./src/test/java/org/junit/tests/experimental/max/DescriptionTest.java","65f717ed35a698239d4a75960b4f6de2f7cce225","Thu, 6 Sep 2012 13:36:16 -0400","Jesse Glick","Varargs makes test slightly shorter."
"./src/test/java/org/junit/tests/experimental/max/DescriptionTest.java","785c7859cd87dc5cb3872fef476ce2f86c9259dd","Thu, 6 Sep 2012 09:57:55 -0400","Jesse Glick","https://github.com/KentBeck/junit/pull/498 review comments."
"./src/test/java/org/junit/tests/experimental/max/DescriptionTest.java","8134371705a43fa2b2a8913678d4336d867f6647","Wed, 5 Sep 2012 20:36:30 -0400","Jesse Glick","Description.getTestClass() did not work reliably. Was assuming that the ClassLoader used for JUnit could also load test classes. While this may be true in a simple test runner based on a flat classpath, it is not true in all test runners. When we are given a Class object, keep it—do not try to reconstruct it from its name alone."
"./src/test/java/org/junit/tests/experimental/max/DescriptionTest.java","b564894980310e40f4c21006ff0c2346c4fc71f6","Mon, 13 Aug 2012 17:41:13 +0200","Petter Måhlén","shortened some lines that were too long"
"./src/test/java/org/junit/tests/experimental/max/DescriptionTest.java","14f9868962aee5bcba8a7595287be1d5fed54b7d","Mon, 4 Jun 2012 14:35:20 +0200","Petter Måhlén","cucumber-jvm issue #322, added a new Description factory method and temporarily changed from Serializable back to Object for the unique id; this needs a change to Gherkin"
"./src/test/java/org/junit/tests/experimental/max/DescriptionTest.java","7944e8f8afbeaff17d337304df52dac227034423","Mon, 28 Nov 2011 22:23:18 +0100","Stefan Birkner","Improved Description class."
"./src/test/java/org/junit/tests/experimental/max/DescriptionTest.java","d9c81356e3a2fbb165c71b32d63d0cc39a1bd861","Wed, 28 Jan 2009 04:18:38 +0000","kbeck","Preparing for 4.6"
"./src/test/java/org/junit/tests/experimental/max/JUnit38SortingTest.java","30f2b16525dabb477373be9ed3e76bb98b200806","Thu, 4 Oct 2012 22:16:45 +0200","Arjan Wulder","Issue #426 Applied new coding style"
"./src/test/java/org/junit/tests/experimental/max/JUnit38SortingTest.java","f3c211455b9e09be36e4bf7ccc499fbdd35a527a","Tue, 10 Mar 2009 10:44:22 -0400","David Saff","Finished release notes, I think"
"./src/test/java/org/junit/tests/experimental/max/JUnit38SortingTest.java","9a2e993c544a2cd1a0b93c9f59340910f51366b4","Mon, 9 Mar 2009 23:10:54 -0400","David Saff","Got rid of unnecessary forget() method"
"./src/test/java/org/junit/tests/experimental/max/JUnit38SortingTest.java","474df716f498aa2695c422cceb3e46cad999e972","Mon, 2 Mar 2009 23:49:40 -0500","David Saff","Some test edits for release notes, but especially experimenting with MaxComputerTest: can MaxCore be written in terms of the Computer abstraction?"
"./src/test/java/org/junit/tests/experimental/max/JUnit38SortingTest.java","d9c81356e3a2fbb165c71b32d63d0cc39a1bd861","Wed, 28 Jan 2009 04:18:38 +0000","kbeck","Preparing for 4.6"
"./src/test/java/org/junit/tests/experimental/max/MaxStarterTest.java","30f2b16525dabb477373be9ed3e76bb98b200806","Thu, 4 Oct 2012 22:16:45 +0200","Arjan Wulder","Issue #426 Applied new coding style"
"./src/test/java/org/junit/tests/experimental/max/MaxStarterTest.java","d9cccce5034bb9876221d271914471b205220061","Wed, 21 Mar 2012 22:48:38 +0100","Marc Philipp","Upgrade to Hamcrest 1.3.0 RC2"
"./src/test/java/org/junit/tests/experimental/max/MaxStarterTest.java","568e29c871ea144e12f273dc7e12c949a5a507da","Wed, 19 May 2010 22:24:16 -0400","dsaff","Adding ClassRules"
"./src/test/java/org/junit/tests/experimental/max/MaxStarterTest.java","97402a3401c6cc2d45d395c0d9d636f483b5571c","Mon, 5 Apr 2010 14:13:46 -0400","dsaff","Most of the plans and mark2 nonsense gone"
"./src/test/java/org/junit/tests/experimental/max/MaxStarterTest.java","86abf33f863fee1db3ba7dd8ee3e9910f105f57d","Thu, 21 Jan 2010 16:30:36 -0500","David Saff","test for multi-level category application"
"./src/test/java/org/junit/tests/experimental/max/MaxStarterTest.java","02fc1f509a670de3632417bbf33168989bfcf872","Tue, 5 Jan 2010 11:51:45 -0500","David Saff","merged with master"
"./src/test/java/org/junit/tests/experimental/max/MaxStarterTest.java","c503e40d9ec79ba76b69dd31d7dd32648fa13cf2","Mon, 4 Jan 2010 22:40:54 -0500","David Saff","Deleted huge time-tripling test, MaxCore uses Plan for recursive descent"
"./src/test/java/org/junit/tests/experimental/max/MaxStarterTest.java","7cd277620b4c888ae4101bb3f4768af83b85313a","Fri, 18 Dec 2009 09:50:45 -0500","David Saff","Better documentation of Filter method, which allows a more succinct definition of ParentRunner"
"./src/test/java/org/junit/tests/experimental/max/MaxStarterTest.java","4e2455b1f142bdf8f07383082638718695e51224","Mon, 20 Jul 2009 10:35:10 -0400","David Saff","Rollback to hamcrest 1.1"
"./src/test/java/org/junit/tests/experimental/max/MaxStarterTest.java","223b34b516467bcd9cb7ebc7f49549f2e7362dca","Wed, 1 Jul 2009 13:43:53 -0400","David Saff","Getting started on Interceptors javadoc"
"./src/test/java/org/junit/tests/experimental/max/MaxStarterTest.java","e35fb32e07a4cfe69dd86024a79d9cb3b9132e55","Wed, 27 May 2009 13:57:07 -0400","David Saff","Upgraded to Hamcrest 1.2"
"./src/test/java/org/junit/tests/experimental/max/MaxStarterTest.java","bbcb8f416628bc168a2ed8353a30b4e9647abf6f","Mon, 25 May 2009 21:51:47 -0400","David Saff","Getting there with FrameworkField, but checking in before everything works, to demo squeezing"
"./src/test/java/org/junit/tests/experimental/max/MaxStarterTest.java","82dd2b3cf88647a5167e336fc97ea2b2b72432be","Mon, 4 May 2009 13:14:30 -0400","David Saff","Removed unnecessary @SuppressWarnings"
"./src/test/java/org/junit/tests/experimental/max/MaxStarterTest.java","c7874453182cde8e7b38cf3ce356d16d3d1dcde8","Wed, 29 Apr 2009 14:19:36 -0700","KentBeck","Fixed error message for malformed JUnit 3.8 test."
"./src/test/java/org/junit/tests/experimental/max/MaxStarterTest.java","f3c211455b9e09be36e4bf7ccc499fbdd35a527a","Tue, 10 Mar 2009 10:44:22 -0400","David Saff","Finished release notes, I think"
"./src/test/java/org/junit/tests/experimental/max/MaxStarterTest.java","9a2e993c544a2cd1a0b93c9f59340910f51366b4","Mon, 9 Mar 2009 23:10:54 -0400","David Saff","Got rid of unnecessary forget() method"
"./src/test/java/org/junit/tests/experimental/max/MaxStarterTest.java","474df716f498aa2695c422cceb3e46cad999e972","Mon, 2 Mar 2009 23:49:40 -0500","David Saff","Some test edits for release notes, but especially experimenting with MaxComputerTest: can MaxCore be written in terms of the Computer abstraction?"
"./src/test/java/org/junit/tests/experimental/max/MaxStarterTest.java","6eb76c8b08c738823546fe5b935b653951fc773e","Tue, 24 Feb 2009 00:00:44 -0500","David Saff","Experiment in filtering JUnit 3 warnings through to the command line"
"./src/test/java/org/junit/tests/experimental/max/MaxStarterTest.java","d9c81356e3a2fbb165c71b32d63d0cc39a1bd861","Wed, 28 Jan 2009 04:18:38 +0000","kbeck","Preparing for 4.6"
"./src/test/java/org/junit/tests/experimental/max/MaxStarterTest.java","34dd9f4e2bebbcf694dcb855a29edff9243a10d3","Tue, 6 Jan 2009 04:02:00 +0000","kbeck","Fixed 2191102 and 2196462."
"./src/test/java/org/junit/tests/experimental/max/MaxStarterTest.java","90bf3119a6326671cc467386036302cc6040f752","Sat, 20 Dec 2008 15:36:48 +0000","kbeck","Description seems to be heading towards Composite. Added "getTestName""
"./src/test/java/org/junit/tests/experimental/max/MaxStarterTest.java","c12af8eb53b2464efff959b633f4c189caf2f1e7","Sat, 22 Nov 2008 00:36:54 +0000","kbeck","A diff got inserted somehow."
"./src/test/java/org/junit/tests/experimental/max/MaxStarterTest.java","421ab330509a53302f56b209595f55b23bfdfc0e","Tue, 18 Nov 2008 22:52:31 +0000","dsaff","Max now runs the right number of tests"
"./src/test/java/org/junit/tests/experimental/max/MaxStarterTest.java","fa6483264ce2530585b374c276c2266d0d0c4ef0","Thu, 13 Nov 2008 19:32:26 +0000","kbeck","closing in on 3.8 multiple run defect"
"./src/test/java/org/junit/tests/experimental/max/MaxStarterTest.java","8d9ac8d65204fe8cd7e1d9146f123a461952bae9","Wed, 12 Nov 2008 22:17:56 +0000","kbeck","Zeroing in on the JUnitMax error where it runs JUnit 3.8 tests multiple times."
"./src/test/java/org/junit/tests/experimental/max/MaxStarterTest.java","85578d48f6459a05665329faa9b52a861e9142cb","Thu, 6 Nov 2008 20:15:27 +0000","kbeck","Now sorting tests globally"
"./src/test/java/org/junit/tests/experimental/max/MaxStarterTest.java","d6662fcc06ec7b07c696eb703c47d3731e4e11c7","Fri, 31 Oct 2008 00:24:00 +0000","kbeck","Oops, checked in some scaffolding and temporary changes"
"./src/test/java/org/junit/tests/experimental/max/MaxStarterTest.java","ce7bda3346278aab6ccebedcd5b8c8d4ab27ba02","Tue, 28 Oct 2008 19:17:15 +0000","kbeck","Persistence for MaxCore"
"./src/test/java/org/junit/tests/experimental/max/MaxStarterTest.java","451ca12156d5704809a1feff78a10a9451cd2023","Thu, 23 Oct 2008 19:38:08 +0000","kbeck","Cleaned up MaxCore and the tests"
"./src/test/java/org/junit/tests/experimental/max/MaxStarterTest.java","378e17964a4188bad9b3d966207a2f682072148e","Thu, 23 Oct 2008 18:59:35 +0000","kbeck","Better test sorting in MaxCore"
"./src/test/java/org/junit/tests/experimental/max/MaxStarterTest.java","a72b0dbef4b01e8ad0b832d9a579dd7fabd5a071","Fri, 17 Oct 2008 22:35:23 +0000","kbeck","Clean up parallel execution naming."
"./src/test/java/org/junit/tests/experimental/rules/RuleChainTest.java","30f2b16525dabb477373be9ed3e76bb98b200806","Thu, 4 Oct 2012 22:16:45 +0200","Arjan Wulder","Issue #426 Applied new coding style"
"./src/test/java/org/junit/tests/experimental/rules/RuleChainTest.java","e8349c5c609fea8706ca926b19fe9c9d0b637a8b","Wed, 14 Sep 2011 22:04:51 +0200","Stefan Birkner","Fixes gh-193 (allow explicit ordering of Rules)."
"./src/test/java/org/junit/tests/experimental/rules/TestWatchmanTest.java","30f2b16525dabb477373be9ed3e76bb98b200806","Thu, 4 Oct 2012 22:16:45 +0200","Arjan Wulder","Issue #426 Applied new coding style"
"./src/test/java/org/junit/tests/experimental/rules/TestWatchmanTest.java","13885b99cf6d2f4bd2efa2211f57c103bbc03263","Wed, 14 Sep 2011 10:09:08 -0400","David Saff","Fixes gh-291: Categories + Parameterized still does not work"
"./src/test/java/org/junit/tests/experimental/rules/TestWatchmanTest.java","ada8735cda0fe94c9cfea9b8fb2012488a3a44e6","Fri, 9 Sep 2011 02:32:53 +0200","Stefan Birkner","fixed issue #296 (TestWatcher and TestWatchman don't call fail when assumption is violated)"
"./src/test/java/org/junit/tests/experimental/rules/ExternalResourceRuleTest.java","30f2b16525dabb477373be9ed3e76bb98b200806","Thu, 4 Oct 2012 22:16:45 +0200","Arjan Wulder","Issue #426 Applied new coding style"
"./src/test/java/org/junit/tests/experimental/rules/ExternalResourceRuleTest.java","99a84a542f2ac532a8425fa0a77884902b1c01b0","Wed, 15 Jul 2009 22:17:25 -0400","David Saff","org.junit.Rule, org.junit.Rules"
"./src/test/java/org/junit/tests/experimental/rules/ExternalResourceRuleTest.java","97afc5e205e1c6ac0f5a9aefabed92d58d88ab81","Wed, 15 Jul 2009 22:12:32 -0400","David Saff","No more Interceptors.  Everything is rules"
"./src/test/java/org/junit/tests/experimental/rules/StopwatchTest.java","103f204ada7363675fcd4a1e2e0a41030a15a9ae","Wed, 19 Dec 2012 00:33:32 +0100","Tibor Digana","Fix usage of actual/expected in #assertEquals"
"./src/test/java/org/junit/tests/experimental/rules/StopwatchTest.java","ebc674b2536e5bda7083dfd7841cf5c3c846b274","Sun, 9 Dec 2012 01:41:46 +0100","Tibor Digana","runtime in Stopwatch rule for Performace tests"
"./src/test/java/org/junit/tests/experimental/rules/StopwatchTest.java","9ec6a3fa39cb8aafe645a7f33e7da9a788679fe3","Tue, 20 Nov 2012 20:25:16 +0100","Tibor Digana","standard JUnit class fields"
"./src/test/java/org/junit/tests/experimental/rules/StopwatchTest.java","3c122b6a93499ee82d346c097141d2137b93c48c","Tue, 20 Nov 2012 18:09:04 +0100","Tibor Digana","using record objects"
"./src/test/java/org/junit/tests/experimental/rules/StopwatchTest.java","cbcb29a2d80b04803566a3aaaffd9dceb53053bf","Mon, 19 Nov 2012 23:55:49 +0100","Tibor Digana","changes"
"./src/test/java/org/junit/tests/experimental/rules/TestWatcherTest.java","b064a274adb12c6e866cb08dedc70534237330b2","Tue, 25 Feb 2014 18:24:04 +0000","Miltos Allamanis","Renamed all Throwables "t" to "e" for naming consistency."
"./src/test/java/org/junit/tests/experimental/rules/TestWatcherTest.java","cf870c0bebf6ca9631594845cd558e1f4fb78b29","Thu, 21 Nov 2013 22:18:44 -0800","reinholdfuereder","Fix many warnings (Eclipse 4.2/Juno based)"
"./src/test/java/org/junit/tests/experimental/rules/TestWatcherTest.java","be6123772ffa7bc580ea44c2db488852255c401f","Wed, 24 Oct 2012 23:10:24 +0200","Mark Michaelis","Readjust due to Issue KentBeck/junit#426 coding style."
"./src/test/java/org/junit/tests/experimental/rules/TestWatcherTest.java","6bc83a0d3a67e36adc2733a125bf928c49f702f9","Wed, 24 Oct 2012 22:45:46 +0200","Mark Michaelis","Merge Master to complete KentBeck/junit#521"
"./src/test/java/org/junit/tests/experimental/rules/TestWatcherTest.java","30f2b16525dabb477373be9ed3e76bb98b200806","Thu, 4 Oct 2012 22:16:45 +0200","Arjan Wulder","Issue #426 Applied new coding style"
"./src/test/java/org/junit/tests/experimental/rules/TestWatcherTest.java","a982920ee8036d001aa4a223a2521be28681ec27","Mon, 1 Oct 2012 08:50:14 +0200","Mark Michaelis","TestWatcher.skipped(): Make test fail"
"./src/test/java/org/junit/tests/experimental/rules/TestWatcherTest.java","2162def2d4eefae0c5668586b837af4ecd4aed91","Sun, 24 Jun 2012 16:41:43 +0100","davidhart82","More tests; fix case if failed and finished throw exceptions"
"./src/test/java/org/junit/tests/experimental/rules/TestWatcherTest.java","c07b3e7ea1b23d84590c2781b978f15e40c94703","Sun, 24 Jun 2012 16:01:53 +0100","davidhart82","Throw MulitpleFailureException"
"./src/test/java/org/junit/tests/experimental/rules/TestWatcherTest.java","ada8735cda0fe94c9cfea9b8fb2012488a3a44e6","Fri, 9 Sep 2011 02:32:53 +0200","Stefan Birkner","fixed issue #296 (TestWatcher and TestWatchman don't call fail when assumption is violated)"
"./src/test/java/org/junit/tests/experimental/rules/TemporaryFolderUsageTest.java","30f2b16525dabb477373be9ed3e76bb98b200806","Thu, 4 Oct 2012 22:16:45 +0200","Arjan Wulder","Issue #426 Applied new coding style"
