fileName,RevisionId,Date,Author,Comment,diffs
"./java/src/test/java/cucumber/runtime/java/JavaStepDefinitionTest.java","e40362a06f8e665149c0847e38865fe686633653","Fri, 13 Jan 2012 13:13:15 -0600","David Kowis","Massive Refactor pulling world out to a higher level.","15;16;17;18;25;41;42;50;51;60;61;81;82;83;84;85;86"
"./java/src/test/java/cucumber/runtime/java/JavaStepDefinitionTest.java","015f73e27f06e45c1e44eb8d0cdfae7daab0d4a3","Mon, 2 Jan 2012 08:30:30 +0000","Aslak Hellesøy","Load resoureces from classpath when using JUnit, load them from filesystem when using CLI","4;41;42"
"./java/src/test/java/cucumber/runtime/java/JavaStepDefinitionTest.java","7164dd3dd398ee2e34ad465637d760a9062c4ead","Sun, 1 Jan 2012 23:44:43 +0000","Aslak Hellesøy","Rewrote a lot of the resource loading code","6;14;41;42;46;47;52;53;59;60;64;65"
"./java/src/test/java/cucumber/runtime/java/JavaStepDefinitionTest.java","2f591ea2801b1266bd44d982dfe9b8f96b2ab4fe","Fri, 9 Dec 2011 18:36:51 +1100","Aslak Hellesøy","JUnit behaves better when a Before hook fails. Closes #106","50;51;60;61"
"./java/src/test/java/cucumber/runtime/java/JavaStepDefinitionTest.java","74bb39f44c9100c69258b5251a2f306c717830a5","Fri, 9 Dec 2011 17:15:43 +1100","Aslak Hellesøy","Throw exceptions, don't return them.","44;45;55;56;62;63;64"
"./java/src/test/java/cucumber/runtime/java/JavaStepDefinitionTest.java","49ec61acb4fb7fc417fcda9f63c28ac27dc40462","Tue, 22 Nov 2011 23:18:41 +0000","Aslak Hellesøy","Better hooks","50;51;60;61"
"./java/src/test/java/cucumber/runtime/java/JavaStepDefinitionTest.java","4b8844a8f8e221b7e85e585e203beda5d400b2ba","Fri, 11 Nov 2011 17:38:07 +0000","Aslak Hellesøy","Tagged (scoped) step definitions are reverted. Bad idea.","27;28;29;34;35;36;47;48;55;56;57;60;66;67;72;73;74;76;77;82;83;84;85;86;87;88;89;90;91;92"
"./java/src/test/java/cucumber/runtime/java/JavaStepDefinitionTest.java","68d4c668d8a3553c056a15859ab9489ddc6fe629","Thu, 10 Nov 2011 13:00:24 +0000","Aslak Hellesøy","Step Deinitions can be scoped by tag (just like hooks). Currently only implemented for Java.","1;2;3;4;5;6;7;8;9;10;11;12;13;14;15;16;17;18;19;20;21;22;23;24;25;26;27;28;29;30;31;32;33;34;35;36;37;38;39;40;41;42;43;44;45;46;47;48;49;50;51;52;53;54;55;56;57;58;59;60;61;62;63;64;65;66;67;68;69;70;71;72;73;74;75;76;77;78;79;80;81;82;83;84;85;86;87;88"
"./java/src/test/java/cucumber/runtime/java/JavaBackendTest.java","71bc1619143458da19d14fe9406931a9b392ceb7","Thu, 26 Jun 2014 14:11:58 +0100","Aslak Hellesøy","Revert "Add new hooks for global level (@BeforeAll and @AfterAll) that run only once before all and after all existing features/scenarios. Unit test and cucumber test to cover the new hooks and the running order between hooks."","59;60;61;62;63;69;70;71;72;73;74;75;76;77;78;79;80;81;82;83"
"./java/src/test/java/cucumber/runtime/java/JavaBackendTest.java","85673e545781519be6b29f5de51309b703dc2e91","Tue, 4 Mar 2014 21:06:49 +0000","andryutz10","Add new hooks for global level (@BeforeAll and @AfterAll) that run only once before all and after all existing features/scenarios. Unit test and cucumber test to cover the new hooks and the running order between hooks. An execution flow with the new hooks looks like this: 1 - @BeforeAll hook(s) (runs before all features once) 2 - @Before hook(s) (no change, same behavior - before every scenario or tagged scenarios) 3 - @After hook(s) (no change, same behavior - after every scenario or tagged scenarios) 4 - .... 2 and 3 for all scenarios in a feature 5 - @AfterAll hook(s) (runs once after all the features are run)","59;60;61;62;63;74;75;76;77;78;79;80;81;82;83;94;95;96;97;98"
"./java/src/test/java/cucumber/runtime/java/JavaBackendTest.java","371efeea34b04e08367f07cae615fae20ae8a081","Wed, 9 Oct 2013 12:08:36 +0100","Aslak Hellesøy","Rename uri to featurePath, which is more explicit","79;80"
"./java/src/test/java/cucumber/runtime/java/JavaBackendTest.java","3e4dae2c35f99d424f7a1a5f447ba36aced51aa1","Sun, 15 Sep 2013 09:27:52 +0100","Aslak Hellesøy","Report summaries and  in the same way as the CLI","8;14;84;85"
"./java/src/test/java/cucumber/runtime/java/JavaBackendTest.java","97b099cb308e7547eb51b932353d161e91da8fe3","Fri, 30 Nov 2012 11:24:39 +0000","Aslak Hellesøy","Formatters can HTTP PUT to an URL","13;15;84;85"
"./java/src/test/java/cucumber/runtime/java/JavaBackendTest.java","324162c03cf50f0675f5a4242e5718d53a143fce","Thu, 11 Oct 2012 01:21:20 +0100","Aslak Hellesøy","Big package reorganisation. This is needed to make it more obvious what's part of the public API and what is not.","3"
"./java/src/test/java/cucumber/runtime/java/JavaBackendTest.java","f999d98e0933d87c10f7937a6705db3767a7da6d","Thu, 3 May 2012 15:29:35 -0500","Aslak Hellesøy","Reformat code. It really gets out of whack when people contribute with all sorts of different IDE settings.","9"
"./java/src/test/java/cucumber/runtime/java/JavaBackendTest.java","4c1644e48717a03f7efad2fc6ba4b9f867d1aef3","Thu, 3 May 2012 15:22:58 -0500","Aslak Hellesøy","Fix several problems with resource loading for scripting languages (after the new classpath: scheme was introduced)","24;25;26;27;30;31;32;33;34;35;39;40;43;44;45;46;48;49;50;51"
"./java/src/test/java/cucumber/runtime/java/JavaBackendTest.java","fb5c95b60554852efac856066b5cfbb056ac76fc","Fri, 20 Apr 2012 09:34:35 +0100","Aslak Hellesøy","Detect subclassing in glue code and report to the user that it's illegal. Closes #301","9;10;11;29;30;37;38;43;44;45;46;47;48;49;50"
"./java/src/test/java/cucumber/runtime/java/JavaBackendTest.java","d3a0c9e09dfe073f4ec1f64ad7cb99526effa6d4","Tue, 3 Apr 2012 20:58:00 +0100","Aslak Hellesøy","Don't convert paths to package names - instead throw an exception. This helps people avoid mistakes.","4;23;24;25;26;27;28;29;30;36;37"
"./java/src/test/java/cucumber/runtime/java/JavaBackendTest.java","34484c41a7fc4c928534edca122aa7adf5e70846","Sun, 5 Feb 2012 17:42:22 +0000","Aslak Hellesøy","Use I18n instead of Locale since converting from Locale to I18n is tricky.","9;17;61;62"
"./java/src/test/java/cucumber/runtime/java/JavaBackendTest.java","e50308a4de38252972d40f2af6ecdc7ebb2a2f1f","Wed, 25 Jan 2012 15:41:26 +0000","Aslak Hellesøy","Properly flush and close formatters. Closes #173","10;11"
"./java/src/test/java/cucumber/runtime/java/JavaBackendTest.java","dbc9fe0c9ed5137cb3135b250387f71440d8afde","Fri, 20 Jan 2012 15:14:05 -0600","David Kowis","Merge branch 'master' into gem_path",""
"./java/src/test/java/cucumber/runtime/java/JavaBackendTest.java","fb26b7aa75e68fc731f338c0a33cbcdf711f98a9","Fri, 20 Jan 2012 14:43:20 +0000","Aslak Hellesoy","Tell, don't ask. And some formatting.","7;9;12;13;16;61;62;63;64;65;66;67"
"./java/src/test/java/cucumber/runtime/java/JavaBackendTest.java","af2ad8b7a64164ec4e147a7a65175129fe4ec36d","Thu, 19 Jan 2012 17:59:07 -0600","David Kowis","Merge branch 'master' into gem_path",""
"./java/src/test/java/cucumber/runtime/java/JavaBackendTest.java","a1c9fbc282059210323e844b40c6967e5c732104","Wed, 18 Jan 2012 16:10:42 -0600","David Kowis","update the tests for the refactoring","8;9;14;15;30;31;32;33;34;35;36;37;38;39;40;41;42;43;44;45;46;47;48;49;50"
"./java/src/test/java/cucumber/runtime/java/JavaBackendTest.java","ec4df84886faaa9e3d37e9d9c4b49687a7d0c9b8","Wed, 18 Jan 2012 10:31:25 -0600","David Kowis","rename world to glue","4;7;25;26;32;33"
"./java/src/test/java/cucumber/runtime/java/JavaBackendTest.java","bd0634ea5ee0d5ba72f7391eb1c2fb2e0ab5763e","Wed, 18 Jan 2012 08:30:33 +0000","Aslak Hellesøy","Removed OneTimeResourceLoader and made sure glue code is loaded only once. The Backend.loadGlue method should ideally be removed, and the World and gluePaths passed to each Backend's constructor. Other TODOs on this branch: rename World to Glue. RuntimeGlue should not have a ref back to Runtime. Make Scala work again (disabled it because I don't have the required Scala fu)","26;27;28"
"./java/src/test/java/cucumber/runtime/java/JavaBackendTest.java","e40362a06f8e665149c0847e38865fe686633653","Fri, 13 Jan 2012 13:13:15 -0600","David Kowis","Massive Refactor pulling world out to a higher level.","15;33;35;36;41;42"
"./java/src/test/java/cucumber/runtime/java/JavaBackendTest.java","6eb5590fc8122467da3a954e0fee1841a9348a94","Thu, 12 Jan 2012 15:55:33 -0600","David Kowis","adding the ability to call a step from another, and pass the table to it","9;10;50;51"
"./java/src/test/java/cucumber/runtime/java/JavaBackendTest.java","e99762090a0854f7afe64f6216a0064b5a05cd33","Wed, 11 Jan 2012 23:08:19 +0000","Aslak Hellesøy","Make a more informative exception in case an undefined step is invoked from a stepdef","43;44;49;50"
"./java/src/test/java/cucumber/runtime/java/JavaBackendTest.java","2b74d1b8c090ba0b781b9a5ebb314f5bfc6f757b","Tue, 10 Jan 2012 17:30:15 -0600","David Kowis","Merge branch 'master' into call_steps",""
"./java/src/test/java/cucumber/runtime/java/JavaBackendTest.java","7164dd3dd398ee2e34ad465637d760a9062c4ead","Sun, 1 Jan 2012 23:44:43 +0000","Aslak Hellesøy","Rewrote a lot of the resource loading code","1;2;3;4;5;6;7;8;9;10;11;12;13;14;15;16;17;18;19;20;21;22;23;24;25;26;27;28;29;30;31;32;33;34;35;36;37;38;39;40;41;42;43;44;45;46;47;48;49;50;51;52;53;54;55;56;57;58;59;60;61;62;63;64;65;66;67;68;69;70;71;72;73;74;75;76;77"
"./java/src/test/java/cucumber/runtime/java/SingletonFactory.java","ff3fe037eae117f66a1aab28a532dc4fdcf962e5","Mon, 22 Apr 2013 22:30:48 +0100","Aslak Hellesøy","Remove warnings and deprecated code","31;32"
"./java/src/test/java/cucumber/runtime/java/SingletonFactory.java","bc9c79171397f92cfe3da071500928d32dc054e9","Sun, 17 Jun 2012 22:39:26 +0100","Aslak Hellesøy","More explanatary exception if a hook is declared with bad parameter types.","3;4;5;6;7;8;9;10;28;29;30;33;34;35;36"
"./java/src/test/java/cucumber/runtime/java/SingletonFactory.java","6b932449b4d4bc0bdceb49fee7a52179716f4413","Thu, 10 May 2012 08:15:46 -0500","Aslak Hellesøy","cucumber-java lazily creates instances, just like the other DI containers","11;12;16;17"
"./java/src/test/java/cucumber/runtime/java/SingletonFactory.java","68d4c668d8a3553c056a15859ab9489ddc6fe629","Thu, 10 Nov 2011 13:00:24 +0000","Aslak Hellesøy","Step Deinitions can be scoped by tag (just like hooks). Currently only implemented for Java.","12;17;22"
"./java/src/test/java/cucumber/runtime/java/SingletonFactory.java","c767dd60c3a9466c4847ab91c4a9f6dddbb8c138","Wed, 31 Aug 2011 01:20:12 +0100","Aslak Hellesøy","Merge with master. Simplified API for converting tables - no longer leaking the Java-specific TableProcessor implementation detail.","1;2;3;4;5;6;7;8;9;10;11;12;13;14;15;16;17;18;19;20;21;22;23;24;25;26;27;28;29"
"./java/src/test/java/cucumber/runtime/java/test/SubstitutionStepdefs.java","9a21bbff1a0584665b3c99aad88e433667fcc37b","Wed, 12 Mar 2014 17:25:00 +0000","Aslak Hellesøy","Align snippets for quoted arguments with cucumber-ruby","22;23"
"./java/src/test/java/cucumber/runtime/java/test/SubstitutionStepdefs.java","79446add277beedd71e2c329103e228fe44b4396","Sun, 14 Oct 2012 02:21:17 +0100","Aslak Hellesøy","Added some tests for Scenario Outline DocString substitution. Removed unused feature files.","1;2;3;4;5;6;7;8;9;10;11;12;13;14;15;16;17;18;19;20;21;22;23;24;25;26;27;28;29;30;31;32;33;34;35;36;37;38;39;40"
"./java/src/test/java/cucumber/runtime/java/test/Stepdefs.java","324162c03cf50f0675f5a4242e5718d53a143fce","Thu, 11 Oct 2012 01:21:20 +0100","Aslak Hellesøy","Big package reorganisation. This is needed to make it more obvious what's part of the public API and what is not.","3;4"
"./java/src/test/java/cucumber/runtime/java/test/Stepdefs.java","6b932449b4d4bc0bdceb49fee7a52179716f4413","Thu, 10 May 2012 08:15:46 -0500","Aslak Hellesøy","cucumber-java lazily creates instances, just like the other DI containers","1;2;3;4;5;6;7;8;9"
"./java/src/test/java/cucumber/runtime/java/test/Stepdefs.java","fb5c95b60554852efac856066b5cfbb056ac76fc","Fri, 20 Apr 2012 09:34:35 +0100","Aslak Hellesøy","Detect subclassing in glue code and report to the user that it's illegal. Closes #301","1;2;3;4;5;6;7;8;9"
"./java/src/test/java/cucumber/runtime/java/test/Stepdefs.java","fb26b7aa75e68fc731f338c0a33cbcdf711f98a9","Fri, 20 Jan 2012 14:43:20 +0000","Aslak Hellesoy","Tell, don't ask. And some formatting.",""
"./java/src/test/java/cucumber/runtime/java/test/Stepdefs.java","7164dd3dd398ee2e34ad465637d760a9062c4ead","Sun, 1 Jan 2012 23:44:43 +0000","Aslak Hellesøy","Rewrote a lot of the resource loading code","1;2;3;4;5;6;7;8;9;10"
"./java/src/test/java/cucumber/runtime/java/test/ScenarioStepDefs.java","9a21bbff1a0584665b3c99aad88e433667fcc37b","Wed, 12 Mar 2014 17:25:00 +0000","Aslak Hellesøy","Align snippets for quoted arguments with cucumber-ruby","30;31"
"./java/src/test/java/cucumber/runtime/java/test/ScenarioStepDefs.java","b3acdbb74ff8d9c7447c4af0a7889701f1da493e","Wed, 5 Mar 2014 14:30:59 +0000","Aslak Hellesøy","Keep generated English Java annotations so we can compile in an IDE. Fix formatting.","9;10"
"./java/src/test/java/cucumber/runtime/java/test/ScenarioStepDefs.java","c3915bf182eb8b468a093a721c79f2d2fffee3fa","Fri, 21 Feb 2014 19:10:41 +0100","Björn Rasmusson","Merge #671. Update History.md.",""
"./java/src/test/java/cucumber/runtime/java/test/ScenarioStepDefs.java","9b3e174e8f75b2ab35c041a4ac3079501950fb4d","Thu, 20 Feb 2014 16:30:16 +0000","Dominic Fox","Dominic: expose scenario name as part of cucumber.api.Scenario","3;4;8;15;16;17;18;19;27;28"
"./java/src/test/java/cucumber/runtime/java/test/ScenarioStepDefs.java","72c7fc7f401027adddd32881590596e1be76636f","Thu, 20 Feb 2014 15:33:35 +0000","Dominic Fox","Dominic: expose current (gherkin) scenario to step definition code via ThreadLocal","1;2;3;4;5;6;7;8;9;10;11;12;13;14;15;16;17;18;19;20;21;22;23;24;25;26;27;28"
"./java/src/test/java/cucumber/runtime/java/test/RunCukesTest.java","70934e4efadb183eecd9a3e0f5f482314001dc1f","Thu, 25 Oct 2012 20:12:05 +0100","Aslak Hellesøy","Moved the JUnit package and configured API docs","3;4"
"./java/src/test/java/cucumber/runtime/java/test/RunCukesTest.java","6b932449b4d4bc0bdceb49fee7a52179716f4413","Thu, 10 May 2012 08:15:46 -0500","Aslak Hellesøy","cucumber-java lazily creates instances, just like the other DI containers","1;2;3;4;5;6;7;8"
"./java/src/test/java/cucumber/runtime/java/test/UnusedGlue.java","324162c03cf50f0675f5a4242e5718d53a143fce","Thu, 11 Oct 2012 01:21:20 +0100","Aslak Hellesøy","Big package reorganisation. This is needed to make it more obvious what's part of the public API and what is not.","3;4;5;6"
"./java/src/test/java/cucumber/runtime/java/test/UnusedGlue.java","56541345d7f5fb4f61fff169d2d3d5be380da9e3","Fri, 11 May 2012 08:28:26 -0500","Aslak Hellesøy","Added proof that unused hooks aren't instantiated.","1;2;3;4;5;6;7;8;9;10;11;12;13;14;15;16;17;18;19;20"
"./java/src/test/java/cucumber/runtime/java/JavaObjectFactoryTest.java","324162c03cf50f0675f5a4242e5718d53a143fce","Thu, 11 Oct 2012 01:21:20 +0100","Aslak Hellesøy","Big package reorganisation. This is needed to make it more obvious what's part of the public API and what is not.","3"
"./java/src/test/java/cucumber/runtime/java/JavaObjectFactoryTest.java","6b932449b4d4bc0bdceb49fee7a52179716f4413","Thu, 10 May 2012 08:15:46 -0500","Aslak Hellesøy","cucumber-java lazily creates instances, just like the other DI containers","16;17;19;20;23;24;26;27"
"./java/src/test/java/cucumber/runtime/java/JavaObjectFactoryTest.java","45e90dee88a9f4060607e5c27eac3c0c0291cc04","Thu, 8 Dec 2011 23:31:25 +0100","A185558","fixing JavaObjectFactoryTest","13;14;18;19;24;25;31;32;33;34"
"./java/src/test/java/cucumber/runtime/java/JavaObjectFactoryTest.java","4b4a277fec62370023dfc87534d86885217db77f","Thu, 8 Dec 2011 23:28:43 +0100","A185558","fixing JavaObjectFactoryTest","1;2;3;4;5;6;7;8;9;10;11;12;13;14;15;16;17;18;19;20;21;22;23;24;25;26;27;28"
"./java/src/test/java/cucumber/runtime/java/MethodScannerTest.java","71bc1619143458da19d14fe9406931a9b392ceb7","Thu, 26 Jun 2014 14:11:58 +0100","Aslak Hellesøy","Revert "Add new hooks for global level (@BeforeAll and @AfterAll) that run only once before all and after all existing features/scenarios. Unit test and cucumber test to cover the new hooks and the running order between hooks."","4;5;6;15;16;17;18;19;20;26;27;32;33;34;35;36;38;39;40;41;42;43;44;45;52;53;52;53;65;66;67;68;70;71;72;73;74;75;76;77;78;79"
"./java/src/test/java/cucumber/runtime/java/MethodScannerTest.java","1ef853fa36b240cc26a65525be94961b59c564f5","Thu, 26 Jun 2014 14:11:49 +0100","Aslak Hellesøy","Revert "Add new hooks for global level (@BeforeAll and @AfterAll) that run only once before all and after all existing features/scenarios. Unit test and cucumber test to cover the new hooks and the running order between hooks."","47;48"
"./java/src/test/java/cucumber/runtime/java/MethodScannerTest.java","39c39a345759016506f27dd137fd52b170e4c105","Tue, 4 Mar 2014 21:19:52 +0000","andryutz10","Add new hooks for global level (@BeforeAll and @AfterAll) that run only once before all and after all existing features/scenarios. Unit test and cucumber test to cover the new hooks and the running order between hooks. An execution flow with the new hooks looks like this: 1 - @BeforeAll hook(s) (runs before all features once) 2 - @Before hook(s) (no change, same behavior - before every scenario or tagged scenarios) 3 - @After hook(s) (no change, same behavior - after every scenario or tagged scenarios) 4 - .... 2 and 3 for all scenarios in a feature 5 - @AfterAll hook(s) (runs once after all the features are run)","47;48"
"./java/src/test/java/cucumber/runtime/java/MethodScannerTest.java","85673e545781519be6b29f5de51309b703dc2e91","Tue, 4 Mar 2014 21:06:49 +0000","andryutz10","Add new hooks for global level (@BeforeAll and @AfterAll) that run only once before all and after all existing features/scenarios. Unit test and cucumber test to cover the new hooks and the running order between hooks. An execution flow with the new hooks looks like this: 1 - @BeforeAll hook(s) (runs before all features once) 2 - @Before hook(s) (no change, same behavior - before every scenario or tagged scenarios) 3 - @After hook(s) (no change, same behavior - after every scenario or tagged scenarios) 4 - .... 2 and 3 for all scenarios in a feature 5 - @AfterAll hook(s) (runs once after all the features are run)","4;5;6;18;19;20;21;22;23;33;34;39;40;41;42;43;45;46;47;48;49;50;51;52;59;60;66;67;79;80;81;82;84;85;86;87;88;89;90;91;92;93"
"./java/src/test/java/cucumber/runtime/java/MethodScannerTest.java","cb3a4cd74d0ea5c2a3baa2946a0964aab69cd920","Sun, 8 Sep 2013 19:07:27 +0100","Aslak Hellesøy","Remove duplication in Reflections implementations.","8;9;23;24"
"./java/src/test/java/cucumber/runtime/java/MethodScannerTest.java","b3a800b987eff1935358b4a7b0ec6db115822d47","Tue, 25 Jun 2013 11:22:49 -0500","Aslak Hellesøy","All tests passing again. Ref #525.","6;7;8;22;23"
"./java/src/test/java/cucumber/runtime/java/MethodScannerTest.java","51da5a80bf5f22210a70132e9fe13e14c2735897","Mon, 24 Jun 2013 23:53:18 -0500","Aslak Hellesøy","Refactoring for #525. WIP.","1;2;3;4;5;6;7;8;9;10;11;12;13;14;15;16;17;18;19;20;21;22;23;24;25;26;27;28;29;30;31;32;33;34;35;36;37;38;39;40;41;42;43;44;45;46;47;48;49;50;51;52;53;54;55;56;57;58;59;60;61;62;63;64;65;66;67;68"
"./java/src/test/java/cucumber/runtime/java/stepdefs/Stepdefs.java","c3915bf182eb8b468a093a721c79f2d2fffee3fa","Fri, 21 Feb 2014 19:10:41 +0100","Björn Rasmusson","Merge #671. Update History.md.",""
"./java/src/test/java/cucumber/runtime/java/stepdefs/Stepdefs.java","72c7fc7f401027adddd32881590596e1be76636f","Thu, 20 Feb 2014 15:33:35 +0000","Dominic Fox","Dominic: expose current (gherkin) scenario to step definition code via ThreadLocal","6"
"./java/src/test/java/cucumber/runtime/java/stepdefs/Stepdefs.java","324162c03cf50f0675f5a4242e5718d53a143fce","Thu, 11 Oct 2012 01:21:20 +0100","Aslak Hellesøy","Big package reorganisation. This is needed to make it more obvious what's part of the public API and what is not.","3;4"
"./java/src/test/java/cucumber/runtime/java/stepdefs/Stepdefs.java","fb5c95b60554852efac856066b5cfbb056ac76fc","Fri, 20 Apr 2012 09:34:35 +0100","Aslak Hellesøy","Detect subclassing in glue code and report to the user that it's illegal. Closes #301","1;2;3;4;5;6;7;8;9;10"
"./java/src/test/java/cucumber/runtime/java/JavaSnippetTest.java","7e1d02fbf4a4c8de366a46972ef967bfa937186b","Sun, 16 Mar 2014 09:38:23 +0000","Aslak Hellesøy","Better comment about tables in java snippets","58;152;153;154;155"
"./java/src/test/java/cucumber/runtime/java/JavaSnippetTest.java","9a21bbff1a0584665b3c99aad88e433667fcc37b","Wed, 12 Mar 2014 17:25:00 +0000","Aslak Hellesøy","Align snippets for quoted arguments with cucumber-ruby","27;28;50;51;62;63"
"./java/src/test/java/cucumber/runtime/java/JavaSnippetTest.java","fa81ba33dbd3e0d9fe1cc125bfc54a127b0b7108","Sat, 2 Nov 2013 20:55:54 +0100","Björn Rasmusson","New Snippet text, closes #618.","29;30;40;41;52;53;64;65;75;76;86;87;97;98;108;109;119;120;130;131;142;143;152;153"
"./java/src/test/java/cucumber/runtime/java/JavaSnippetTest.java","fe0efce85cfa29c94b58279f07089da406f2fb15","Sun, 13 Oct 2013 00:16:54 +0100","Aslak Hellesøy","Refactored SnippetGenerator.","3;5;6;22;28;29;51;52;74;75;85;86;96;97;107;108;118;119;129;130;151;152;162;163;168;169;174;175"
"./java/src/test/java/cucumber/runtime/java/JavaSnippetTest.java","036025fb0f919169a97842bdd2d14ce9fb210f58","Thu, 26 Sep 2013 22:24:36 +0100","Guy Burton","Added plus and period to escaped characters","93;94;99;100"
"./java/src/test/java/cucumber/runtime/java/JavaSnippetTest.java","838fe1f32fdb4928eaa87a7db3dd6d8b9f87b43d","Tue, 13 Aug 2013 22:02:38 +0100","Aslak Hellesøy","Refactored --snippet option. Closes #561, #302","4;160;161;166;167;172;173"
"./java/src/test/java/cucumber/runtime/java/JavaSnippetTest.java","857652be9aad35f0ad2feb0d7019b3041cdf5592","Fri, 12 Apr 2013 09:04:16 +0100","Aslak Hellesøy","Bugfix: Generated regex for ? character is incorrect. Closes #494.","79;80;81;82;83;84;85;86;87;88;89;90;91;92;93;94;95;96;97;98;99;100"
"./java/src/test/java/cucumber/runtime/java/JavaSnippetTest.java","a56358e4033cc160630f45858a9f29d65173d66c","Thu, 25 Oct 2012 02:11:24 +0100","Aslak Hellesøy","Some last minute fixes before the 1.1.0 release.","116;117"
"./java/src/test/java/cucumber/runtime/java/JavaSnippetTest.java","e9155c864d745a2e7f0f6f776c5981e42ce4075a","Wed, 16 May 2012 11:59:50 +0200","Petter Måhlén","issue 318: added 'throws Throwable' to Java snippets","25;26;36;37;48;49;60;61;71;72;82;83;93;94;104;105;116;117;126;127"
"./java/src/test/java/cucumber/runtime/java/JavaSnippetTest.java","f99069e44cf3b630a1159f96b57cc6c730946ab4","Thu, 22 Mar 2012 07:17:47 +0000","Aslak Hellesøy","Update all snippets to throw PendingException, following up on #271. Need to make Clojure do this.","27;38;50;62;73;84;95;106;129"
"./java/src/test/java/cucumber/runtime/java/JavaSnippetTest.java","cc60df482041a790abfa35bdb00e2250c2e421db","Wed, 21 Mar 2012 11:02:09 +0000","Aslak Hellesøy","Added failing test for #272","8;104;105;106;107;108;109;110;111;112;113;114"
"./java/src/test/java/cucumber/runtime/java/JavaSnippetTest.java","d9502fbd0f2d64b1ac6dfb0dd9de98f76bd50321","Tue, 20 Mar 2012 10:16:01 +0000","Aslak Hellesøy","Snippets for DataTable include a hint about using List<YourType>, so people discover this neat technique","108"
"./java/src/test/java/cucumber/runtime/java/JavaSnippetTest.java","3c13008abf2348cdf4064570306d45ab6523083c","Tue, 20 Mar 2012 10:01:39 +0000","Aslak Hellesøy","Support DocString and DataTable in generated snippets. Closes #227","5;6;11;13;18;19;92;93;94;95;96;97;98;99;100;101;102;103;104;105;106;107;108;109;110;111;112;114;115;116;117;118;119;120;121;122;123;124;125"
"./java/src/test/java/cucumber/runtime/java/JavaSnippetTest.java","a477bed9a54ff9df2d79dee2dc6cc340805c0662","Sun, 19 Feb 2012 13:11:31 -0800","Ian Dees","Escape regex characters in steps","56;57;58;59;60;61;62;63;64;65;66;67;68;69;70;71;72;73;74;75;76;77;78;79;80;81;82;83;84;85"
"./java/src/test/java/cucumber/runtime/java/JavaSnippetTest.java","b34455c60dca12f1daa0da6d2ab84ffde2c97f76","Sat, 14 Jan 2012 18:11:35 +0000","Aslak Hellesøy","Replace inheritance with delegation for #138","1;2;3;4;5;6;7;8;9;10;11;12;13;14;15;16;17;18;19;20;21;22;23;24;25;26;27;28;29;30;31;32;33;34;35;36;37;38;39;40;41;42;43;44;45;46;47;48;49;50;51;52;53;54;55;56;57;58;59;60"
"./java/src/main/java/cucumber/api/java/Before.java","47a8510f0580a50494c60386dfb698a1c4ba83a7","Thu, 12 Sep 2013 09:46:29 +0100","Aslak Hellesøy","Timeout is a long, not int. Be explicit that it's millis.","17;18;20;21"
"./java/src/main/java/cucumber/api/java/Before.java","b7c7bc4fe81b495dc3ef5eb1936ddde828e85b49","Wed, 24 Oct 2012 20:34:52 +0100","Aslak Hellesøy","The  annotation is replaced with an  property on  and","20;21;22;23;24;25"
"./java/src/main/java/cucumber/api/java/Before.java","324162c03cf50f0675f5a4242e5718d53a143fce","Thu, 11 Oct 2012 01:21:20 +0100","Aslak Hellesøy","Big package reorganisation. This is needed to make it more obvious what's part of the public API and what is not.","1;2;3;4;5;6;7;8;9;10;11;12;13;14;15;16;17;18;19;20"
"./java/src/main/java/cucumber/api/java/After.java","47a8510f0580a50494c60386dfb698a1c4ba83a7","Thu, 12 Sep 2013 09:46:29 +0100","Aslak Hellesøy","Timeout is a long, not int. Be explicit that it's millis.","17;18;20;21"
"./java/src/main/java/cucumber/api/java/After.java","b7c7bc4fe81b495dc3ef5eb1936ddde828e85b49","Wed, 24 Oct 2012 20:34:52 +0100","Aslak Hellesøy","The  annotation is replaced with an  property on  and","20;21;22;23;24;25"
"./java/src/main/java/cucumber/api/java/After.java","324162c03cf50f0675f5a4242e5718d53a143fce","Thu, 11 Oct 2012 01:21:20 +0100","Aslak Hellesøy","Big package reorganisation. This is needed to make it more obvious what's part of the public API and what is not.","1;2;3;4;5;6;7;8;9;10;11;12;13;14;15;16;17;18;19;20"
